id,title,option_1,option_2,option_3,option_4,answer,section_id
145,Three number are in the ratio of 3 : 4 : 5 and their L.C.M. is 2400. Their H.C.F. is:,30,40,89,76,40,2
146,"The G.C.D. of 1.08, 0.36 and 0.9 is:",0.18,1.2,0.1,9.89,0.18,2
147,The product of two numbers is 2028 and their H.C.F. is 13. The number of such pairs is:,8,6,2,5,2,2
148,"The least multiple of 7, which leaves a remainder of 4, when divided by 6, 9, 15 and 18 is:",23,789,364,67,364,2
149,"Find the lowest common multiple of 24, 36 and 40.",457,360,879,690,360,2
150,"The least number which should be added to 2497 so that the sum is exactly divisible by 5, 6, 4 and 3 is:",2,67,55,23,23,2
151,"The least number which when divided by 5, 6 , 7 and 8 leaves a remainder 3, but when divided by 9 leaves no remainder, is:",2341,5680,1683,3457,1683,2
152,"	
The H.C.F. of two numbers is 11 and their L.C.M. is 7700. If one of the numbers is 275, then the other is:",308,111,453,678,308,2
153,"What will be the least number which when doubled will be exactly divisible by 12, 18, 21 and 30 ?",789,456,230,630,630,2
154,The ratio of two numbers is 3 : 4 and their H.C.F. is 4. Their L.C.M. is:,48,23,76,55,48,2
155,"The smallest number which when diminished by 7, is divisible 12, 16, 18, 21 and 28 is:",1067,1015,3450,2398,1015,2
156,"The greatest possible length which can be used to measure exactly the lengths 7 m, 3 m 85 cm, 12 m 95 cm is:",32cm,46cm,55cm,35cm,35cm,2
157,Three numbers which are co-prime to each other are such that the product of the first two is 551 and that of the last two is 1073. The sum of the three numbers is:,85,75,45,23,85,2
158,Find the highest common factor of 36 and 84.,12,78,56,34,12,2
159,"The least number, which when divided by 12, 15, 20 and 54 leaves in each case a remainder of 8 is:",548,67,89,678,548,2
160,"The greatest number which on dividing 1657 and 2037 leaves remainders 6 and 5 respectively, is:",34,78,127,54,127,2
161,Which of the following has the most number of divisors?,176,45,67,789,176,2
162,The L.C.M. of two numbers is 48. The numbers are in the ratio 2 : 3. Then sum of the number is:,89,67,40,54,40,2
163,"A boat can travel with a speed of 13 km/hr in still water. If the speed of the stream is 4 km/hr, find the time taken by the boat to go 68 km downstream.",4 hours,5 hours,8 hours,7 houes,4 hours,2
164,"A motorboat, whose speed in 15 km/hr in still water goes 30 km downstream and comes back in a total of 4 hours 30 minutes. The speed of the stream (in km/hr) is:",5,8,9,4,5,2
168,What percent is 2 minutes 24 seconds of an hour?,6%,2%,4%,8%,4%,2
169,Adding 20% of x to x is equivalent to multiplying x by which of the following?,12.5,1.05,1.15,1.2,1.2,2
170,The salary of all officers is increased twice successively by 20%. What is the net percentage increase in their salaries?,20%,40%,21%,44%,44%,2
171,In an examination it is necessary for a candidate to get 45 % of the maximum marks to pass. A candidate who gets 180 marks; fails by 45 marks. Find the maximum marks.,450,600,500,550,500,2
172,The population of a town increase annually by 20% . If the present population is 2;00;000; then what is the difference in population after two years and three years,"63,250","48,800","60,800","57,600","57,600",2
173,Population of a city decreases by 10% at the end of first year and increases by 10% at the end of second year and again decreases by 10% at the end of third year. If the population of the city at the end of third year is 4455; then what was the population of the city at the beginning of the first year?,5000,4500,4950,1000,5000,2
174,In an exam 80% of the boys and 40% of the girls passed. The number of girls who passed is 120; which is 2/3rd of the number of boys who failed. What is the total number of students who appeared for the exam?,1200,380,3800,2180,1200,2
175,The population of cities A and B is equal. The population of city A increases in two successive years by 20% and 15% respectively and that of city B increases successively by 20% and 10% respectively. If the difference in the population of two cities after 2 years is 768; then what was the total population of the two cities initially?,"12,800","26,500","24,600","25,600","25,600",2
176,What quantity of water should be added to reduce 5 litres of 45% acidic liquid to 25% acidic liquid?,3 liters,2 liters,4 liters,4.5 liters,4 liters,2
177,A; B; and C contest an election from a particular constituency. A and B together got 50% more votes than C. The vote share of A and C together is 30 percentage points more than the vote share of B. Who won the election?,A,B,C,Cannot be determined,C,2
178,In an examination amar got 8% less than the pass mark and mohan got 20% more than the pass mark. If the difference between the percentage of their mark is 14; then what is the pass percentage,40%,50%,60%,Cannot be determined,50%,2
179,The salaries of A and B together is Rs. 14;000. A spend 80% of his salary and B spends 85% of his salary. What is the salary of B if their savings are equal?,Rs 6000,RS 8000,Rs 7500,Rs 6500,RS 8000,2
180,A sum of Rs. 395 was divided among A; B; and C in such a way that B gets 25% more than A and 20% more than C. What is the share of A?,Rs 185,RS 190,Rs 98,Rs 120,Rs 120,2
181,Three times a number is 20% more than twice another number when increased by 105. If twice the first number increased by 36 is 20% less than three times of the second number; then what is the first number?,150,162,180,None of these,162,2
182,If 5 women or 8 girls can do a work in 84 days. In how many days can 10 women and 5 girls can do the same work?,32 days,48 days,52 days,38 days,32 days,2
183,If 34 men completed 2/5th of a work in 8 days working 9 hours a day. How many more man should be engaged to finish the rest of the work in 6 days working 9 hours a day?,89,98,102,142,102,2
184,If 9 men working 6 hours a day can do a work in 88 days. Then 6 men working 8 hours a day can do it in how many days?,89 days,90 days,85 days,99 days,99 days,2
185,A is twice as good a workman as B and together they finish a piece of work in 18 days. In how many days will A alone finish the work?,31 days,25 days,27 days,29 days,27 days,2
186,"Worker A takes 8 hours to do a job. Worker B takes 10 hours to do the same job. How long it take both A & B, working together but independently, to do the same job?",40/9 days,40/7 days,7.5 days,8.5 days,40/9 days,2
187,A can do a piece of work n 7 days of 9 hours each and B alone can do it in 6 days of 7 hours each. How long will they take to do it working together 8 2/5 hours a day?,3,4,5,6,3,2
189,A can do a piece of work in 80 days. He works at it for 10 days & then B alone finishes the remaining work in 42 days. In how much time will A and B; working together; finish the work?,23 days,25 days,30 days,33 days,30 days,2
190,In each of the following questions a number series is given with one term missing. Choose the correct alternative that will continue the same pattern and fill in the blank spaces.2; 7; 14; 23; ?; 47,31,28,34,38,34,2
191,In each of the following questions a number series is given with one term missing. Choose the correct alternative that will continue the same pattern and fill in the blank spaces. 4; 6; 12; 14; 28; 30; ? ,32,64,62,60,60,2
192,In each of the following questions a number series is given with one term missing. Choose the correct alternative that will continue the same pattern and fill in the blank spaces,57,70,63,75,57,2
193,In each of the following questions a number series is given with one term missing. Choose the correct alternative that will continue the same pattern and fill in the blank spaces 11; 13; 17; 19; 23; 29; 31; 37; 41; ? ,43,47,51,53,43,2
194,In each of the following questions a number series is given with one term missing. Choose the correct alternative that will continue the same pattern and fill in the blank spaces 15; 31; 63; 127; 255; ? ,513,511,523,517,511,2
195,In each of the following questions a number series is given with one term missing. Choose the correct alternative that will continue the same pattern and fill in the blank spaces 5; 11; 17; 25; 33; 43; ? ,49,51,52,53,53,2
196,In each of the following questions a number series is given with one term missing. Choose the correct alternative that will continue the same pattern and fill in the blank spaces 9; 12; 11; 14; 13; ?;15 ,12,16,10,17,16,2
197,In each of the following questions a number series is given with one term missing. Choose the correct alternative that will continue the same pattern and fill in the blank spaces 0.5; 0.55; 0.65; 0.8; ? ,0.7,0.9,0.95,1,1,2
198,In each of the following questions a number series is given with one term missing. Choose the correct alternative that will continue the same pattern and fill in the blank spaces1; 4; 9; 16; 25; ?,35,36,48,49,36,2